{
  "schema_version": 1,
  "skill_id": "city-real-estate-habitat-promo",
  "display_name": "城市与地产人居宣传片",
  "description": "将城市地标、楼盘布局、立面细节和阳台景观等参考素材编排为城市叙事到社区平视穿梭的人居宣传片提示词。",
  "references": [
    {
      "id": "city-context",
      "media_type": "image",
      "role": "scene",
      "description": "城市级地标、江河、桥梁、天际线或宏观城市叙事参考",
      "required": true,
      "min_count": 1,
      "max_count": null,
      "ordered": true,
      "observation_required": true
    },
    {
      "id": "real-estate-context",
      "media_type": "image",
      "role": "scene",
      "description": "楼盘鸟瞰布局、立面细节、社区空间或阳台景观参考，用于楼盘几何和人居空间绑定",
      "required": true,
      "min_count": 1,
      "max_count": null,
      "ordered": true,
      "observation_required": true
    }
  ],
  "video": {
    "reference_required": true,
    "allowed_modes": [
      "image2video",
      "multimodal2video"
    ]
  },
  "authoring": {
    "primary_language": "zh-CN",
    "preserve_professional_english": true,
    "user_instruction_priority": "highest",
    "timing_strategy": "adaptive",
    "transition_strategy": "adaptive",
    "requires_prompt_confirmation": true,
    "requires_reference_binding": true
  },
  "knowledge": {
    "creative_guidance": "references/creative-guidance.md",
    "community_experience": "references/community-experience.md",
    "failure_cases": "references/failure-cases.md",
    "examples": "references/examples.md"
  }
}
